{
  "name": "Mitte seed",
  "schema_version": "0.2",
  "tick_length": "month",
  "metadata": {
    "source": "synthetic",
    "source_url": null,
    "source_date": null,
    "license": null,
    "confidence": "low",
    "notes": "Prototype seed data for model development before real-data import."
  },
  "districts": [
    {
      "id": "mitte",
      "name": "Mitte",
      "attractiveness": 0.86,
      "transit_access": 0.92,
      "job_access": 0.9,
      "tourism_pressure": 0.72,
      "policy_intensity": 0.55
    }
  ],
  "neighborhoods": [
    {
      "id": "alexanderplatz",
      "district_id": "mitte",
      "name": "Alexanderplatz",
      "demand_pressure": 0.9,
      "income_mix": "high"
    },
    {
      "id": "wedding_edge",
      "district_id": "mitte",
      "name": "Wedding edge",
      "demand_pressure": 0.68,
      "income_mix": "mixed"
    }
  ],
  "parcels": [
    {
      "id": "parcel_mitte_001",
      "neighborhood_id": "alexanderplatz",
      "land_value": 1200000,
      "zoning_capacity": 24,
      "redevelopment_friction": 0.7,
      "owner_id": "owner_private_001"
    },
    {
      "id": "parcel_mitte_002",
      "neighborhood_id": "wedding_edge",
      "land_value": 640000,
      "zoning_capacity": 18,
      "redevelopment_friction": 0.52,
      "owner_id": "owner_coop_001"
    }
  ],
  "buildings": [
    {
      "id": "building_001",
      "parcel_id": "parcel_mitte_001",
      "built_year": 1910,
      "condition": 0.62,
      "energy_quality": 0.42,
      "renovation_level": 0.35,
      "operating_cost_per_sqm": 3.8
    },
    {
      "id": "building_002",
      "parcel_id": "parcel_mitte_002",
      "built_year": 1965,
      "condition": 0.74,
      "energy_quality": 0.58,
      "renovation_level": 0.5,
      "operating_cost_per_sqm": 3.1
    }
  ],
  "units": [
    {
      "id": "unit_001",
      "building_id": "building_001",
      "sqm": 62,
      "rooms": 2,
      "tenure": "rental",
      "monthly_rent": 1050,
      "estimated_sale_price": 455000,
      "regulated": true,
      "vacant": false,
      "household_id": "household_001"
    },
    {
      "id": "unit_002",
      "building_id": "building_001",
      "sqm": 88,
      "rooms": 3,
      "tenure": "rental",
      "monthly_rent": 1680,
      "estimated_sale_price": 690000,
      "regulated": false,
      "vacant": true,
      "household_id": null
    },
    {
      "id": "unit_003",
      "building_id": "building_002",
      "sqm": 54,
      "rooms": 2,
      "tenure": "rental",
      "monthly_rent": 690,
      "estimated_sale_price": 310000,
      "regulated": true,
      "vacant": false,
      "household_id": "household_002"
    }
  ],
  "owners": [
    {
      "id": "owner_private_001",
      "kind": "private_landlord",
      "liquidity": 180000,
      "risk_tolerance": 0.62,
      "social_mission": 0.1
    },
    {
      "id": "owner_coop_001",
      "kind": "cooperative",
      "liquidity": 90000,
      "risk_tolerance": 0.28,
      "social_mission": 0.86
    }
  ],
  "households": [
    {
      "id": "household_001",
      "income_monthly": 4200,
      "savings": 26000,
      "size": 2,
      "rent_burden_tolerance": 0.34,
      "buying_interest": 0.22,
      "neighborhood_preference": "alexanderplatz"
    },
    {
      "id": "household_002",
      "income_monthly": 2350,
      "savings": 4800,
      "size": 1,
      "rent_burden_tolerance": 0.36,
      "buying_interest": 0.03,
      "neighborhood_preference": "wedding_edge"
    }
  ]
}
